<?xml version="1.0" encoding="UTF-8"?>
<!-- GENERATED by build_lookups.py - edit the rules there, not this file. -->
<lookup name="productClass" xmlns:xsi="http://www.w3.org/2001/XMLSchema-instance" xsi:noNamespaceSchemaLocation="lookup.xsd">
  <entry raw="ANDA" std="Human"/>
  <entry raw="BLA" std="Human"/>
  <entry raw="DISINFECTANT" std="Disinfectant"/>
  <entry raw="HUMAN" std="Human"/>
  <entry raw="NDA" std="Human"/>
  <entry raw="RADIOPHARMACEUTICAL" std="Human"/>
  <entry raw="VETERINARY" std="Veterinary"/>
</lookup>
