<?xml version="1.0" encoding="UTF-8"?>
<!-- GENERATED by build_lookups.py - edit the rules there, not this file. -->
<lookup name="route" xmlns:xsi="http://www.w3.org/2001/XMLSchema-instance" xsi:noNamespaceSchemaLocation="lookup.xsd">
  <entry raw="" std=""/>
  <entry raw="0-UNASSIGNED" std=""/>
  <entry raw="ARTHOGRAPHY" std="Intra-articular"/>
  <entry raw="BILIARY" std="Biliary"/>
  <entry raw="BLOCK/INFILTRATION" std="Infiltration"/>
  <entry raw="BUCCAL" std="Buccal"/>
  <entry raw="CARDIAC" std="Cardiac"/>
  <entry raw="CONCENTRATE" std=""/>
  <entry raw="CYSTOGRAPHY" std="Intravesical"/>
  <entry raw="DENTAL" std="Dental"/>
  <entry raw="DISINFECTANT (BARN)" std="Disinfectant"/>
  <entry raw="DISINFECTANT (CONTACT LENS)" std="Disinfectant"/>
  <entry raw="DISINFECTANT (DOMESTIC)" std="Disinfectant"/>
  <entry raw="DISINFECTANT (FOOD PREMISES)" std="Disinfectant"/>
  <entry raw="DISINFECTANT (HOSPITAL/HC FACILITIES)" std="Disinfectant"/>
  <entry raw="DISINFECTANT (INSTITUTIONAL/INDUSTRIAL)" std="Disinfectant"/>
  <entry raw="DISINFECTANT (MEDICAL INSTRUMENTS)" std="Disinfectant"/>
  <entry raw="DROPS" std=""/>
  <entry raw="ENDOCERVICAL" std="Endocervical"/>
  <entry raw="ENDOTRACHEAL" std="Intratracheal"/>
  <entry raw="ENTERAL" std="Oral"/>
  <entry raw="EPIDURAL" std="Epidural"/>
  <entry raw="EXTENDED RELEASE" std=""/>
  <entry raw="EXTRACORPOREAL" std="Extracorporeal"/>
  <entry raw="FILM COATED" std=""/>
  <entry raw="FOR RX COMPOUNDING" std=""/>
  <entry raw="FOR SOLUTION" std=""/>
  <entry raw="GASTRIC" std="Gastric"/>
  <entry raw="HAEMODIALYSIS" std="Haemodialysis"/>
  <entry raw="HAEMODIALYSIS (INTRAPERITONEAL)" std="Intraperitoneal"/>
  <entry raw="IM-IV" std="Intramuscular; Intravenous"/>
  <entry raw="IMPLANT" std="Implantation"/>
  <entry raw="IMPLANTATION" std="Implantation"/>
  <entry raw="INFILTRATION" std="Infiltration"/>
  <entry raw="INHALATION" std="Inhalation"/>
  <entry raw="INJECTABLE" std="Injection"/>
  <entry raw="INJECTION" std="Injection"/>
  <entry raw="INSTILLATION" std="Instillation"/>
  <entry raw="INTERSTITIAL" std="Interstitial"/>
  <entry raw="INTRA-AMNIOTIC" std="Intra-amniotic"/>
  <entry raw="INTRA-ANAL" std="Rectal"/>
  <entry raw="INTRA-ARTERIAL" std="Intra-arterial"/>
  <entry raw="INTRA-ARTICULAR" std="Intra-articular"/>
  <entry raw="INTRABRANCHIAL" std="Intrabranchial"/>
  <entry raw="INTRABURSAL" std="Intrabursal"/>
  <entry raw="INTRACAMERAL" std="Intraocular"/>
  <entry raw="INTRACARDIAC" std="Intracardiac"/>
  <entry raw="INTRACAUDAL" std="Intracaudal"/>
  <entry raw="INTRACAVERNOSAL" std="Intracavernosal"/>
  <entry raw="INTRACAVITARY" std="Intracavitary"/>
  <entry raw="INTRACEREBROVENTRICULAR" std="Intracerebroventricular"/>
  <entry raw="INTRACERVICAL" std="Intracervical"/>
  <entry raw="INTRACORONARY" std="Intracoronary"/>
  <entry raw="INTRACRANIAL" std="Intracranial"/>
  <entry raw="INTRACUTANEOUS" std="Intradermal"/>
  <entry raw="INTRADERMAL" std="Intradermal"/>
  <entry raw="INTRADETRUSORIAL" std="Intradetrusorial"/>
  <entry raw="INTRADISCAL" std="Intradiscal"/>
  <entry raw="INTRAGANGLIONAL" std="Intraganglional"/>
  <entry raw="INTRAGLANDULAR" std="Intraglandular"/>
  <entry raw="INTRAINTESTINAL (UPPER)" std="Intestinal"/>
  <entry raw="INTRALESIONAL" std="Intralesional"/>
  <entry raw="INTRALYMPHATIC" std="Intralymphatic"/>
  <entry raw="INTRAMAMMARY" std="Intramammary"/>
  <entry raw="INTRAMUSCULAR" std="Intramuscular"/>
  <entry raw="INTRAOCULAR" std="Intraocular"/>
  <entry raw="INTRAOSSEOUS" std="Intraosseous"/>
  <entry raw="INTRAPERITONEAL" std="Intraperitoneal"/>
  <entry raw="INTRAPLEURAL" std="Intrapleural"/>
  <entry raw="INTRAPULMONARY" std="Intrapulmonary"/>
  <entry raw="INTRARUMINAL" std="Intraruminal"/>
  <entry raw="INTRASPINAL" std="Intraspinal"/>
  <entry raw="INTRASYNOVIAL" std="Intrasynovial"/>
  <entry raw="INTRATENDINOUS" std="Intratendinous"/>
  <entry raw="INTRATHECAL" std="Intrathecal"/>
  <entry raw="INTRATHORACIC" std="Intrathoracic"/>
  <entry raw="INTRATRACHEAL" std="Intratracheal"/>
  <entry raw="INTRAUTERINE" std="Intrauterine"/>
  <entry raw="INTRAVASCULAR" std="Intravascular"/>
  <entry raw="INTRAVENOUS" std="Intravenous"/>
  <entry raw="INTRAVENTRICULAR" std="Intraventricular"/>
  <entry raw="INTRAVESICAL" std="Intravesical"/>
  <entry raw="INTRAVESICULAR" std="Intravesical"/>
  <entry raw="INTRAVITREAL" std="Intravitreal"/>
  <entry raw="INTUBING" std="Intratracheal"/>
  <entry raw="IONTOPHORESIS" std="Iontophoresis"/>
  <entry raw="IRRIGATION" std="Irrigation"/>
  <entry raw="IV (INFUSION)" std="Intravenous"/>
  <entry raw="LABORATORY TEST" std=""/>
  <entry raw="MISCELLANEOUS" std=""/>
  <entry raw="MULTIDOSE" std=""/>
  <entry raw="N/A" std=""/>
  <entry raw="NASAL" std="Nasal"/>
  <entry raw="NASOGASTRIC" std="Nasogastric"/>
  <entry raw="NERVE BLOCK" std="Infiltration"/>
  <entry raw="NIL" std=""/>
  <entry raw="OPHTHALMIC" std="Ophthalmic"/>
  <entry raw="ORAL" std="Oral"/>
  <entry raw="ORAL AND TABLET" std="Oral"/>
  <entry raw="ORAL AND TABLET; DELAYED RELEASE" std="Oral and tablet; delayed release"/>
  <entry raw="ORAL SUSPENSION" std="Oral"/>
  <entry raw="ORAL-20" std="Oral"/>
  <entry raw="ORAL-21" std="Oral"/>
  <entry raw="ORAL-28" std="Oral"/>
  <entry raw="ORALLY DISINTEGRATING" std="Oral"/>
  <entry raw="OTIC" std="Otic"/>
  <entry raw="PARENTERAL (UNSPECIFIED)" std="Injection"/>
  <entry raw="PERCUTANEOUS" std="Percutaneous"/>
  <entry raw="PERFUSION" std="Intravenous"/>
  <entry raw="PERIARTICULAR" std="Periarticular"/>
  <entry raw="PERIODONTAL" std="Periodontal"/>
  <entry raw="PERIOSTEAL" std="Periosteal"/>
  <entry raw="POWDER" std=""/>
  <entry raw="PREFILLED" std=""/>
  <entry raw="PYELOCALYCEAL" std="Pyelocalyceal"/>
  <entry raw="RECTAL" std="Rectal"/>
  <entry raw="REFER (SEE DOSAGE FORM)" std=""/>
  <entry raw="RETROBULBAR" std="Retrobulbar"/>
  <entry raw="SINGLE-DOSE" std=""/>
  <entry raw="SINGLE-USE" std=""/>
  <entry raw="SOFT TISSUE INJECTION" std="Injection"/>
  <entry raw="SOLUTION" std=""/>
  <entry raw="SPINAL" std="Intraspinal"/>
  <entry raw="SUBARACHNOIDAL" std="Intrathecal"/>
  <entry raw="SUBCUTANEOUS" std="Subcutaneous"/>
  <entry raw="SUBCUTANEOUS LYOPHILIZED POWER" std="Subcutaneous"/>
  <entry raw="SUBGINGIVAL" std="Subgingival"/>
  <entry raw="SUBLINGUAL" std="Sublingual"/>
  <entry raw="SUBMUCOSAL" std="Submucosal"/>
  <entry raw="SUBRETINAL" std="Subretinal"/>
  <entry raw="SUPRACHOROIDAL" std="Suprachoroidal"/>
  <entry raw="SURGICAL" std="Surgical"/>
  <entry raw="SUSPENSION" std=""/>
  <entry raw="TEAT DILATOR" std="Intramammary"/>
  <entry raw="TEAT-DIP" std="Topical"/>
  <entry raw="TOPICAL" std="Topical"/>
  <entry raw="TOPICAL (COMMERCIAL)" std="Topical"/>
  <entry raw="TOPICAL (FOOD PREMISES)" std="Topical"/>
  <entry raw="TOPICAL (HOSPITAL/HC FACILITIES)" std="Topical"/>
  <entry raw="TOPICAL (HOUSEHOLD)" std="Topical"/>
  <entry raw="TRANSDERMAL" std="Transdermal"/>
  <entry raw="TRANSMUCOSAL" std="Transmucosal"/>
  <entry raw="UDDER WASH" std="Topical"/>
  <entry raw="UNKNOWN" std=""/>
  <entry raw="URETERAL" std="Ureteral"/>
  <entry raw="URETHRAL" std="Urethral"/>
  <entry raw="VAGINAL" std="Vaginal"/>
</lookup>
