<?xml version="1.0" encoding="UTF-8"?>
<!-- GENERATED by build_lookups.py - edit the rules there, not this file. -->
<lookup name="strengthUnit" xmlns:xsi="http://www.w3.org/2001/XMLSchema-instance" xsi:noNamespaceSchemaLocation="lookup.xsd">
  <entry raw="%" std="%"/>
  <entry raw="%1.2GM" std=""/>
  <entry raw="%100MG" std=""/>
  <entry raw="%200MG" std=""/>
  <entry raw="%4%" std=""/>
  <entry raw="-0.1MCI" std=""/>
  <entry raw="-1.4MCI" std=""/>
  <entry raw="-1.7" std=""/>
  <entry raw="-100" std=""/>
  <entry raw="-1000MCI" std=""/>
  <entry raw="-100MCI" std=""/>
  <entry raw="-100ML" std=""/>
  <entry raw="-100UCI" std=""/>
  <entry raw="-106MCI" std=""/>
  <entry raw="-1153MCI" std=""/>
  <entry raw="-130MCI" std=""/>
  <entry raw="-135MCI" std=""/>
  <entry raw="-150MCI" std=""/>
  <entry raw="-16600MCI" std=""/>
  <entry raw="-19" std=""/>
  <entry raw="-2.22" std=""/>
  <entry raw="-2.7" std=""/>
  <entry raw="-20" std=""/>
  <entry raw="-200MCI" std=""/>
  <entry raw="-221MCI" std=""/>
  <entry raw="-240MCI" std=""/>
  <entry raw="-250MCI" std=""/>
  <entry raw="-25MCI" std=""/>
  <entry raw="-260MCI" std=""/>
  <entry raw="-2703MCI" std=""/>
  <entry raw="-2MCI" std=""/>
  <entry raw="-3" std=""/>
  <entry raw="-300MCI" std=""/>
  <entry raw="-300UCI" std=""/>
  <entry raw="-30MCI" std=""/>
  <entry raw="-30ML" std=""/>
  <entry raw="-33.1MCI" std=""/>
  <entry raw="-400MCI" std=""/>
  <entry raw="-40MCI" std=""/>
  <entry raw="-4MCI" std=""/>
  <entry raw="-5" std=""/>
  <entry raw="-5.5MCI" std=""/>
  <entry raw="-500MCI" std=""/>
  <entry raw="-50ML" std=""/>
  <entry raw="-550UCI" std=""/>
  <entry raw="-55MCI" std=""/>
  <entry raw="-5MCI" std=""/>
  <entry raw="-600MCI" std=""/>
  <entry raw="-60MCI" std=""/>
  <entry raw="-8MCI" std=""/>
  <entry raw="-90MCI" std=""/>
  <entry raw="-91.5MCI" std=""/>
  <entry raw="/ML" std=""/>
  <entry raw="A" std=""/>
  <entry raw="ACTIVATION" std="actuation"/>
  <entry raw="ACTUATION" std="actuation"/>
  <entry raw="AMP" std="ampoule"/>
  <entry raw="AN/A" std=""/>
  <entry raw="B" std="B"/>
  <entry raw="BAR" std="bar"/>
  <entry raw="BOT" std="bottle"/>
  <entry raw="BVG" std="vg"/>
  <entry raw="C" std="C"/>
  <entry raw="CARTRIDGE" std="cartridge"/>
  <entry raw="CCID50" std="CCID50"/>
  <entry raw="CELLS" std="cells"/>
  <entry raw="CFU" std="CFU"/>
  <entry raw="CH" std="CH"/>
  <entry raw="CI" std="Ci"/>
  <entry raw="CMK" std="CMK"/>
  <entry raw="COPPER" std=""/>
  <entry raw="CSR" std="CSR U"/>
  <entry raw="CU" std="CU"/>
  <entry raw="CYLINDER" std="cylinder"/>
  <entry raw="D" std="D"/>
  <entry raw="DAY" std="day"/>
  <entry raw="DELIVERY" std="actuation"/>
  <entry raw="DH" std="DH"/>
  <entry raw="DOSE" std="dose"/>
  <entry raw="FFU" std="FFU"/>
  <entry raw="FIBER" std="fiber"/>
  <entry raw="G" std="g"/>
  <entry raw="GAL" std="GAL"/>
  <entry raw="GALU" std="GALU"/>
  <entry raw="GBQ" std="GBq"/>
  <entry raw="GENERATOR" std="generator"/>
  <entry raw="GENOME" std="genome copies"/>
  <entry raw="GM" std="g"/>
  <entry raw="GM/BOT17.5GM/BOTN/AN/AN/AN/A" std=""/>
  <entry raw="GM0.74GM2.86GM5.6GM" std=""/>
  <entry raw="GMBASE" std="g"/>
  <entry raw="GRAM" std="g"/>
  <entry raw="HR" std="h"/>
  <entry raw="IMPLANT" std="implant"/>
  <entry raw="INH" std="actuation"/>
  <entry raw="IU" std="IU"/>
  <entry raw="K" std="K"/>
  <entry raw="KBQ" std="kBq"/>
  <entry raw="KG" std="kg"/>
  <entry raw="KG/DAY" std=""/>
  <entry raw="KIT" std="kit"/>
  <entry raw="KIU" std="KIU"/>
  <entry raw="L" std="L"/>
  <entry raw="LF" std="Lf"/>
  <entry raw="LM" std="LM"/>
  <entry raw="LOG10" std="log10"/>
  <entry raw="M" std="M"/>
  <entry raw="MBQ" std="MBq"/>
  <entry raw="MCCI" std="mcCi"/>
  <entry raw="MCG" std="mcg"/>
  <entry raw="MCI" std="mCi"/>
  <entry raw="MCI-150MCI" std=""/>
  <entry raw="MCI-188MCI" std=""/>
  <entry raw="MCI-225MCI" std=""/>
  <entry raw="MCI-260MCI" std=""/>
  <entry raw="MCI-300MCI" std=""/>
  <entry raw="MCI-487.5MCI" std=""/>
  <entry raw="MCI-800MCI" std=""/>
  <entry raw="MCI/ML" std=""/>
  <entry raw="MCL" std="mcL"/>
  <entry raw="MCMOL" std="mcmol"/>
  <entry raw="MEQ" std="mEq"/>
  <entry raw="MG" std="mg"/>
  <entry raw="MG." std=""/>
  <entry raw="MG/0.5MG" std=""/>
  <entry raw="MG/25MG" std=""/>
  <entry raw="MG/300MG" std=""/>
  <entry raw="MG/VIAL" std=""/>
  <entry raw="MG0.01MG" std=""/>
  <entry raw="MG0.01MGN" std=""/>
  <entry raw="MG0.025MG0.025MG" std=""/>
  <entry raw="MG0.035MG" std=""/>
  <entry raw="MG0.035MG0.035MG" std=""/>
  <entry raw="MG0.03MG0.035MG" std=""/>
  <entry raw="MG0.04MG0.03MG" std=""/>
  <entry raw="MG0.075MG0.125MG" std=""/>
  <entry raw="MG0.125MG0.15MG" std=""/>
  <entry raw="MG0.15MG" std=""/>
  <entry raw="MG0.1MG" std=""/>
  <entry raw="MG0.215MG0.25MG" std=""/>
  <entry raw="MG0.3MG" std=""/>
  <entry raw="MG0.451MG" std=""/>
  <entry raw="MG0.625MG" std=""/>
  <entry raw="MG0.75MG1MG" std=""/>
  <entry raw="MG10MG" std=""/>
  <entry raw="MG10MG20MG40MG" std=""/>
  <entry raw="MG160MG" std=""/>
  <entry raw="MG1MG" std=""/>
  <entry raw="MG1MG0.5MG" std=""/>
  <entry raw="MG1MG1MG" std=""/>
  <entry raw="MG2.5MG" std=""/>
  <entry raw="MG2MG2MG1MGN" std=""/>
  <entry raw="MG37.5MG25MG" std=""/>
  <entry raw="MG3MGN" std=""/>
  <entry raw="MG7.5MG" std=""/>
  <entry raw="MG75MG50MG" std=""/>
  <entry raw="MGC" std=""/>
  <entry raw="MGML" std=""/>
  <entry raw="MGN" std=""/>
  <entry raw="MICROGRAMS" std=""/>
  <entry raw="MIU" std="MIU"/>
  <entry raw="ML" std="mL"/>
  <entry raw="ML)" std=""/>
  <entry raw="ML." std=""/>
  <entry raw="ML/VIAL" std=""/>
  <entry raw="MLN/A" std=""/>
  <entry raw="MMG" std=""/>
  <entry raw="MMOL" std="mmol"/>
  <entry raw="N/A" std=""/>
  <entry raw="NG" std="ng"/>
  <entry raw="NIL" std=""/>
  <entry raw="PACKET" std="packet"/>
  <entry raw="PATCH" std="patch"/>
  <entry raw="PFU" std="PFU"/>
  <entry raw="POUCH" std="pouch"/>
  <entry raw="PPM" std="ppm"/>
  <entry raw="PRESSOR" std="U"/>
  <entry raw="SCOOPFUL" std="scoop"/>
  <entry raw="SPRAY" std="spray"/>
  <entry raw="SQ" std="cm2"/>
  <entry raw="TCID50" std="TCID50"/>
  <entry raw="TEASPOONFUL" std="teaspoon"/>
  <entry raw="TM" std="TM"/>
  <entry raw="TRACE" std=""/>
  <entry raw="TU" std="TU"/>
  <entry raw="U" std="U"/>
  <entry raw="UCI" std="mcCi"/>
  <entry raw="UG" std="mcg"/>
  <entry raw="UGM" std="mcg"/>
  <entry raw="UMOLAR" std=""/>
  <entry raw="UNIT" std="U"/>
  <entry raw="UNITS" std="U"/>
  <entry raw="UNKNOWN" std=""/>
  <entry raw="USP" std="USP U"/>
  <entry raw="V" std=""/>
  <entry raw="VG" std="vg"/>
  <entry raw="VIAL" std="vial"/>
  <entry raw="VIALN/A" std=""/>
  <entry raw="VP" std="VP"/>
  <entry raw="W" std=""/>
  <entry raw="X" std="X"/>
  <entry raw="XMK" std="XMK"/>
</lookup>
