<?xml version="1.0" encoding="UTF-8"?>
<!-- GENERATED by build_lookups.py - edit the rules there, not this file. -->
<lookup name="regulatoryStatus" xmlns:xsi="http://www.w3.org/2001/XMLSchema-instance" xsi:noNamespaceSchemaLocation="lookup.xsd">
  <entry raw="APPLICATION WITHDRAWN" std="Application withdrawn" sortKey="5-Application withdrawn"/>
  <entry raw="APPROVED" std="Authorised" sortKey="1-Authorised"/>
  <entry raw="AUTHORISED" std="Authorised" sortKey="1-Authorised"/>
  <entry raw="AUTHORIZATION BY INTERIM ORDER EXPIRED" std="Withdrawn" sortKey="4-Withdrawn"/>
  <entry raw="AUTHORIZATION BY INTERIM ORDER REVOKED" std="Withdrawn" sortKey="4-Withdrawn"/>
  <entry raw="CANCELLED (SAFETY ISSUE)" std="Withdrawn" sortKey="4-Withdrawn"/>
  <entry raw="CANCELLED (UNRETURNED ANNUAL)" std="Withdrawn" sortKey="4-Withdrawn"/>
  <entry raw="CANCELLED POST MARKET" std="Withdrawn" sortKey="4-Withdrawn"/>
  <entry raw="CANCELLED PRE MARKET" std="Application withdrawn" sortKey="5-Application withdrawn"/>
  <entry raw="DISCONTINUED" std="Withdrawn" sortKey="4-Withdrawn"/>
  <entry raw="DORMANT" std="Authorised" sortKey="1-Authorised"/>
  <entry raw="EXPIRED" std="Withdrawn" sortKey="4-Withdrawn"/>
  <entry raw="FOR FURTHER MANUFACTURING USE" std="Authorised" sortKey="1-Authorised"/>
  <entry raw="LAPSED" std="Withdrawn" sortKey="4-Withdrawn"/>
  <entry raw="MARKETED" std="Authorised" sortKey="1-Authorised"/>
  <entry raw="NONE (TENTATIVE APPROVAL)" std="Pending" sortKey="3-Pending"/>
  <entry raw="OPINION" std="Pending" sortKey="3-Pending"/>
  <entry raw="OPINION UNDER RE-EXAMINATION" std="Pending" sortKey="3-Pending"/>
  <entry raw="OVER-THE-COUNTER" std="Authorised" sortKey="1-Authorised"/>
  <entry raw="PRESCRIPTION" std="Authorised" sortKey="1-Authorised"/>
  <entry raw="REFUSED" std="Refused" sortKey="6-Refused"/>
  <entry raw="REVOKED" std="Withdrawn" sortKey="4-Withdrawn"/>
  <entry raw="SUSPENDED" std="Suspended" sortKey="2-Suspended"/>
  <entry raw="WITHDRAWN" std="Withdrawn" sortKey="4-Withdrawn"/>
  <entry raw="WITHDRAWN FROM ROLLING REVIEW" std="Application withdrawn" sortKey="5-Application withdrawn"/>
</lookup>
